{
  "$schema": "https://json-schema.org/draft/2020-12/schema",
  "title": "Code Intel Settings",
  "type": "object",
  "additionalProperties": false,
  "required": ["version", "path", "astGrep", "fallback", "languages"],
  "properties": {
    "version": { "const": 1 },
    "path": {
      "type": "object",
      "additionalProperties": false,
      "required": ["extraDirs"],
      "properties": {
        "extraDirs": { "type": "array", "items": { "type": "string" } }
      }
    },
    "astGrep": {
      "type": "object",
      "additionalProperties": false,
      "required": ["command", "configPath"],
      "properties": {
        "command": { "type": "string", "minLength": 1, "not": { "const": "sg" } },
        "configPath": { "type": ["string", "null"] }
      }
    },
    "fallback": { "type": "array", "items": { "type": "string" }, "minItems": 1 },
    "languages": {
      "type": "object",
      "additionalProperties": {
        "type": "object",
        "additionalProperties": false,
        "required": ["astGrep", "lsp"],
        "properties": {
          "extensions": { "type": "array", "items": { "type": "string", "pattern": "^\\." } },
          "filenames": { "type": "array", "items": { "type": "string", "minLength": 1 } },
          "globs": { "type": "array", "items": { "type": "string", "minLength": 1 } },
          "shebangs": { "type": "array", "items": { "type": "string", "minLength": 1 } },
          "precedence": { "type": "number" },
          "astGrep": {
            "type": "object",
            "additionalProperties": false,
            "required": ["languageId"],
            "properties": {
              "languageId": { "type": "string", "minLength": 1 }
            }
          },
          "lsp": {
            "type": "object",
            "additionalProperties": false,
            "properties": {
              "languageId": { "type": "string", "minLength": 1 },
              "command": { "type": "string", "minLength": 1 },
              "args": { "type": "array", "items": { "type": "string" } },
              "commands": { "type": "array", "items": { "type": "string" } },
              "capabilities": { "type": "array", "items": { "type": "string" } },
              "expectedCapabilities": { "type": "array", "items": { "type": "string" } },
              "initializationOptions": {
                "type": ["object", "array", "string", "number", "boolean", "null"]
              },
              "settings": {
                "type": ["object", "array", "string", "number", "boolean", "null"]
              }
            }
          }
        }
      }
    }
  }
}
